<?xml version="1.0" encoding="UTF-8"?>
<!-- Werner Bailer (JOANNEUM RESEARCH) -->
<FIMSAMECards xmlns:xsi="http://www.w3.org/2001/XMLSchema-instance" xsi:noNamespaceSchemaLocation="../schema/FIMS-AME.xsd">
	<AMECard>
		<CardID>T005</CardID>
		<Name>Tokenisation</Name>
		<Type>Text</Type>
		<Status>draft</Status>
		<Editor>Alberto</Editor>
		<Definition>The detection of words, phrases, symbols (tokens) in a text.</Definition>
		<Parameters>
			<Inputs>
				<!-- no input params, assuming the text is provided as a resource to the FIMS service
				<Input>
					<Name>InputText</Name>
					<Type>text</Type>
					<Representation>TBD, could also be XML</Representation>
					<Definition>The input text to be processed (required)</Definition>
				</Input>		
				-->
				<Input>
					<Name>POSResults</Name>
					<Type>xml</Type>
					<Definition>The results of POS tagging on the input text, where available</Definition>
				</Input>
			</Inputs>
			<Outputs>
				<Output mandatory="true">
					<Name>Tokens</Name>
					<Type>xml</Type>
					<Representation>urn:tbd</Representation>
					<Definition>list of detected tokens, possibly with confidence scores</Definition>
				</Output>
			</Outputs>
		</Parameters>
		<CapabilityGroup name="Text Types">
			<Capability>
				<Values>urn:oiweuowieru</Values>
				<Type>supported languages</Type>
			</Capability>
			<Capability>
				<Values>urn:sfsdjkh</Values>
				<Type>supported scripts</Type>
			</Capability>
		</CapabilityGroup>
		<CapabilityGroup name="input formats">
			<Capability>
				<Values>urn:cvds</Values>
				<Type>supported text formats</Type>
			</Capability>
		</CapabilityGroup>
	</AMECard>
</FIMSAMECards>
