<?xml version="1.0" encoding="UTF-8"?>
<FIMSAMECards xmlns:xsi="http://www.w3.org/2001/XMLSchema-instance" xsi:noNamespaceSchemaLocation="../schema/FIMS-AME.xsd">
	<AMECard>
		<CardID>V020</CardID>
		<Name>Concept detection</Name>
		<Type>Video</Type>
		<Status>draft</Status>
		<Editor>Lauri</Editor>
		<Definition>Determine if a video segment represents a specified/one from a list of specified concept class(es). A concept is visually represented by the content, but not a particular object. Examples are day/night, indoor/outdoor, rural, ... Also includes basic actions such as person walking, person greeting other person.</Definition>
		<Parameters>
			<Inputs>
				<Input mandatory="false">
					<Name>OutputFormat</Name>
					<Type>controlled vocabulary</Type>
				</Input>			
				<Input mandatory="true">
					<Name>ClassesToDetect</Name>
					<Type>xml</Type>
					<Representation/>
				</Input>
				<Input>
					<Name>ConceptModelToUse</Name>
					<Type>URL</Type>
					<Definition>If applicable, visual model to use for detection.</Definition>
				</Input>
				<Input>
					<Name>InputSegmentationXml</Name>
					<Type>xml</Type>
					<Representation>urn:mpeg:mpeg7:schema:2004:TemporalDecompositionType/urn:mpeg:mpeg7:schema:2004:AudiovisualSegmentType</Representation>
					<Definition>The timeline of segments with their start and end times.</Definition>
				</Input>
				<Input>
					<Name>InputSegmentationJson</Name>
					<Type>json</Type>
					<Representation>urn:mpeg:mpeg7:schema:2004:TemporalDecompositionType/urn:mpeg:mpeg7:schema:2004:AudiovisualSegmentType</Representation>
					<Definition>The timeline of segments with their start and end times.</Definition>
				</Input>
			</Inputs>
			<Outputs>
				<Output mandatory="true">
					<Name>DetectedConcepts</Name>
					<Type>xml</Type>
					<Type>json</Type>
					<Representation/>
					<Comment>Per concept class, a list of time segments, optionally with confidence scores for each detection.</Comment>
				</Output>
			</Outputs>
		</Parameters>
		<CapabilityGroup xsi:type="inputFormatCapabilityGroupType">
			<Capability xsi:type="videoFormatCapabilityType">
				<Values>urn:ebu:metadata-cs:FileFormatCS_2010</Values>
				<Type>http://ebu.io/fims/ame/capabilities/format/video</Type>
			</Capability>
			<Capability xsi:type="imageFormatCapabilityType">
				<Values>urn:ebu:metadata-cs:FileFormatCS_2010</Values>
				<Type>http://ebu.io/fims/ame/capabilities/format/image</Type>
			</Capability>
		</CapabilityGroup>
		<CapabilityGroup xsi:type="inputCodecCapabilityGroupType">
			<Capability xsi:type="videoCodecCapabilityType">
				<Values>urn:ebu:metadata-cs:VideoCompressionCodeCS</Values>
				<Type>http://ebu.io/fims/ame/capabilities/codec/video</Type>
			</Capability>
		</CapabilityGroup>
		<CapabilityGroup xsi:type="resultCapabilityGroupType">
			<Capability xsi:type="resultCapabilityType" parameter="DetectedConcepts">
				<Type>http://ebu.io/fims/ame/capabilities/parameter</Type>
				<Formats>http://abc.com/formats</Formats>
				<Representations>http://abc.com/representations</Representations>
			</Capability>
		</CapabilityGroup>
	</AMECard>
</FIMSAMECards>