<?xml version="1.0" encoding="UTF-8"?>
<FIMSAMECards xmlns:xsi="http://www.w3.org/2001/XMLSchema-instance" xsi:noNamespaceSchemaLocation="../schema/FIMS-AME.xsd">
	<AMECard>
		<CardID>T006</CardID>
		<Name>Language identification (Text)</Name>
		<Type>Text</Type>
		<Status>draft</Status>
		<Editor>Werner</Editor>
		<Definition>The recognition of the language of a text</Definition>
		<Parameters>
			<Inputs>
				<Input mandatory="false">
					<Name>OutputFormat</Name>
					<Type>controlled vocabulary</Type>
				</Input>
			</Inputs>
			<Outputs>
				<Output mandatory="true">
					<Name>TextSegments</Name>
					<Type>xml</Type>
					<Type>json</Type>
					<Representation>urn:tbd</Representation>
					<Definition>A list segments with start and end position (time stamp or word count), together with a language identifier according to ISO 639-1, -2 or -3, and an optional confidence score.</Definition>
				</Output>
			</Outputs>
		</Parameters>
		<CapabilityGroup xsi:type="inputCodecCapabilityGroupType">
			<Capability xsi:type="textEncodingCapabilityType">
				<Values>https://www.iana.org/assignments/character-sets/character-sets.xhtml</Values>
				<Type>http://ebu.io/fims/ame/capabilities/codec/textencoding</Type>
			</Capability>
		</CapabilityGroup>
		<CapabilityGroup xsi:type="inputFormatCapabilityGroupType">
			<Capability xsi:type="textFormatCapabilityType">
				<Values>https://www.iana.org/assignments/media-types/media-types.xhtml</Values>
				<Type>http://ebu.io/fims/ame/capabilities/format/text</Type>
			</Capability>
		</CapabilityGroup>
		<CapabilityGroup xsi:type="textCapabilityGroupType">
			<Capability xsi:type="textLanguageCapabilityType">
				<Values>urn:iso:std:iso:639:-1 urn:iso:std:iso:639:-2</Values>
				<Type>http://ebu.io/fims/ame/capabilities/text/language</Type>
			</Capability>
			<Capability xsi:type="textScriptCapabilityType">
				<Values>urn:iso:std:iso:15924</Values>
				<Type>http://ebu.io/fims/ame/capabilities/text/script</Type>
			</Capability>
		</CapabilityGroup>
		<CapabilityGroup xsi:type="resultCapabilityGroupType">
			<Capability xsi:type="resultCapabilityType" parameter="TextSegments">
				<Type>http://ebu.io/fims/ame/capabilities/parameter</Type>
				<Formats>http://abc.com/formats</Formats>
				<Representations>http://abc.com/representations</Representations>
			</Capability>
		</CapabilityGroup>		
	</AMECard>
</FIMSAMECards>
