<?xml version="1.0" encoding="UTF-8"?>
<FIMSAMECards xmlns:xsi="http://www.w3.org/2001/XMLSchema-instance" xsi:noNamespaceSchemaLocation="../schema/FIMS-AME.xsd">
	<AMECard>
		<CardID>M001</CardID>
		<Name>Scene/story segmentation</Name>
		<Type>Multimodal</Type>
		<Status>draft</Status>
		<Editor>Werner</Editor>
		<Definition>Segment an audiovisual segment into semantic temporal units, such as news stories, scenes, etc.</Definition>
		<Parameters>
			<Inputs>
				<Input mandatory="false">
					<Name>OutputFormat</Name>
					<Type>controlled vocabulary</Type>
				</Input>
				<Input>
					<Name>MinDuration</Name>
					<Type>float</Type>
					<Unit>seconds</Unit>
					<Definition>Minimum duration of a segment to be reported.</Definition>
					<DefaultValue>0</DefaultValue>
				</Input>
				<Input>
					<Name>MaxDuration</Name>
					<Type>float</Type>
					<Unit>seconds</Unit>
					<Definition>Maximium duration of a segment to be reported.</Definition>
					<DefaultValue>inf</DefaultValue>
				</Input>				
			</Inputs>
			<Outputs>
				<Output>
					<Name>Segmentation</Name>
					<Type>xml</Type>
					<Type>json</Type>
					<Representation>urn:mpeg:mpeg7:schema:2004:TemporalDecompositionType/urn:mpeg:mpeg7:schema:2004:AudiovisualSegmentType</Representation>
					<Definition>The timeline of segments with their start and end times.</Definition>
				</Output>
			
			</Outputs>
		</Parameters>
		<CapabilityGroup xsi:type="inputFormatCapabilityGroupType">
			<Capability xsi:type="audioFormatCapabilityType">
				<Values>urn:ebu:metadata-cs:FileFormatCS_2010</Values>
				<Type>http://ebu.io/fims/ame/capabilities/format/audio</Type>
			</Capability>
			<Capability xsi:type="videoFormatCapabilityType">
				<Values>urn:ebu:metadata-cs:FileFormatCS_2010</Values>
				<Type>http://ebu.io/fims/ame/capabilities/format/video</Type>
			</Capability>
			<Capability xsi:type="textFormatCapabilityType">
				<Values>https://www.iana.org/assignments/media-types/media-types.xhtml</Values>
				<Type>http://ebu.io/fims/ame/capabilities/format/text</Type>
			</Capability>
		</CapabilityGroup>
		<CapabilityGroup xsi:type="inputCodecCapabilityGroupType">
			<Capability xsi:type="audioCodecCapabilityType">
				<Values>urn:ebu:metadata-cs:AudioCompressionCodeCS</Values>
				<Type>http://ebu.io/fims/ame/capabilities/codec/audio</Type>
			</Capability>
			<Capability xsi:type="videoCodecCapabilityType">
				<Values>urn:ebu:metadata-cs:VideoCompressionCodeCS</Values>
				<Type>http://ebu.io/fims/ame/capabilities/codec/video</Type>
			</Capability>
			<Capability xsi:type="textEncodingCapabilityType">
				<Values>https://www.iana.org/assignments/character-sets/character-sets.xhtml</Values>
				<Type>http://ebu.io/fims/ame/capabilities/codec/textencoding</Type>
			</Capability>
		</CapabilityGroup>
		<CapabilityGroup xsi:type="contentTypeCapabilityGroupType">
			<Capability xsi:type="modalityCapabilityType">
				<Values>urn:mpeg:mpeg7:cs:ContentCS:2001</Values>
				<Type>http://ebu.io/fims/ame/capabilities/modalities</Type>
			</Capability>
		</CapabilityGroup>
		<CapabilityGroup xsi:type="genericCapabilityGroupType" type="ContentGenres">
			<Capability xsi:type="genericCapabilityType">
				<Values>urn:ebu:metadata-cs:ContentGenreCS</Values>
				<Type>http://ebu.io/fims/ame/capabilities/genres</Type>
			</Capability>
		</CapabilityGroup>
		<CapabilityGroup xsi:type="resultCapabilityGroupType">
			<Capability xsi:type="resultCapabilityType" parameter="Segmentation">
				<Type>http://ebu.io/fims/ame/capabilities/parameter</Type>
				<Formats>http://abc.com/formats</Formats>
				<Representations>http://abc.com/representations</Representations>
			</Capability>
		</CapabilityGroup>
		<CapabilityGroup xsi:type="textCapabilityGroupType">
			<Capability xsi:type="textLanguageCapabilityType">
				<Values>urn:iso:std:iso:639:-1 urn:iso:std:iso:639:-2</Values>
				<Type>http://ebu.io/fims/ame/capabilities/text/language</Type>
			</Capability>
			<Capability xsi:type="textScriptCapabilityType">
				<Values>urn:iso:std:iso:15924</Values>
				<Type>http://ebu.io/fims/ame/capabilities/text/script</Type>
			</Capability>
		</CapabilityGroup>
	</AMECard>
</FIMSAMECards>
