<?xml version="1.0" encoding="UTF-8"?>
<!-- edited with XMLSpy v2017 sp2 (x64) (http://www.altova.com) by Alberto Messina (RAI - Radiotelevisione Italiana) -->
<FIMSAMECards xmlns:xsi="http://www.w3.org/2001/XMLSchema-instance" xsi:noNamespaceSchemaLocation="../schema/FIMS-AME.xsd">
	<AMECard>
		<CardID>V015</CardID>
		<Name>Instance search (Indexing)</Name>
		<Type>Video</Type>
		<Status>draft</Status>
		<Editor>Lauri</Editor>
		
		<Definition>Extract features from a video and index them in a database for later matching.</Definition>
		<Parameters>
			<Inputs>
				<Input>
					<Name>TargetDescriptorSize</Name>
					<Type>integer</Type>
					<Unit>bytes/second</Unit>
					<Definition>The target bitrate of the desccriptors to be extracted.</Definition>
				</Input>
				<Input mandatory="true">
					<Name>DBIdentifier</Name>
					<Type>URL</Type>
					<Definition>The identifier of the database in which the descriptors/fingerprints shall be indexed.</Definition>
				</Input>
			</Inputs>
			<Outputs>
				<Output mandatory="true">
					<Name>DBIdentifier</Name>
					<Type>URL</Type>
					<Definition>The identifier of the database in which the descriptors/fingerprints have been indexed.</Definition>
				</Output>
			</Outputs>
		</Parameters>
		<!--TODO: Descriptor sizes need clarification-->
		<CapabilityGroup xsi:type="genericCapabilityGroupType" type="descriptorSizes">
			<Capability type="supportedDescriptorSize">
				<Type>integer</Type>
				<Unit>bytes/second</Unit>
			</Capability>
		</CapabilityGroup>
		<CapabilityGroup xsi:type="inputFormatCapabilityGroupType">
			<Capability xsi:type="videoFormatCapabilityType">
				<Values>urn:ebu:metadata-cs:FileFormatCS_2010</Values>
				<Type>http://ebu.io/fims/ame/capabilities/format/video</Type>
			</Capability>
			<Capability xsi:type="imageFormatCapabilityType">
				<Values>urn:ebu:metadata-cs:FileFormatCS_2010</Values>
				<Type>http://ebu.io/fims/ame/capabilities/format/image</Type>
			</Capability>
		</CapabilityGroup>
		<CapabilityGroup xsi:type="inputCodecCapabilityGroupType">
			<Capability xsi:type="videoCodecCapabilityType">
				<Values>urn:ebu:metadata-cs:VideoCompressionCodeCS</Values>
				<Type>http://ebu.io/fims/ame/capabilities/codec/video</Type>
			</Capability>
		</CapabilityGroup>
	</AMECard>
</FIMSAMECards>
