<?xml version="1.0" encoding="UTF-8"?>
<FIMSAMECards xmlns:xsi="http://www.w3.org/2001/XMLSchema-instance" xsi:noNamespaceSchemaLocation="../schema/FIMS-AME.xsd">
	<AMECard>
		<CardID>V008</CardID>
		<Name>Face Detection</Name>
		<Type>Video</Type>
		<Status>draft</Status>
		<Editor>Werner</Editor>
		<Definition>Determine if there are one or more regions showing (part of) a human face, and report their approximate boundaries.</Definition>
		<Parameters>
			<Inputs>
				<Input mandatory="false">
					<Name>OutputFormat</Name>
					<Type>controlled vocabulary</Type>
				</Input>
				<Input>
					<Name>StructuredRegionOfInterest</Name>
					<Type>xml</Type>
					<Representation>urn:mpeg:mpeg7:schema:2004:MovingRegionType</Representation>
					<Definition>A region in which to perform the detection.</Definition>
				</Input>
				<Input>
					<Name>MinimumSize</Name>
					<Type>integer</Type>
					<Unit>pixels</Unit>
					<Definition>The minimum size of faces to be detected in pixels.</Definition>
					<DefaultValue>50</DefaultValue>
				</Input>
				<Input>
					<Name>MaximumSize</Name>
					<Type>integer</Type>
					<Unit>pixels</Unit>
					<Definition>The maximum size of faces to be detected in pixels.</Definition>
					<DefaultValue>500</DefaultValue>
				</Input>	
				<Input>
					<Name>ModelToUse</Name>
					<Type>URL</Type>
					<Definition>The model for detection to use, if applicable (e.g., force use of frontal or lateral models only).</Definition>
				</Input>
			</Inputs>
			<Outputs>
				<Output >
					<Name>Detection</Name>
					<Type>xml</Type>
					<Type>json</Type>
					<Representation>urn:mpeg:mpeg7:schema:2004:MovingRegionType/urn:mpeg:mpeg7:schema:2004:MovingRegionType</Representation>
					<Comment>The output regions where faces have been detected</Comment>
				</Output>
			</Outputs>
		</Parameters>
		<CapabilityGroup xsi:type="detectionCapabilityGroupType">
			<Capability xsi:type="minDetectionSizeCapabilityType">
				<Values>integer</Values>
				<Type>http://ebu.io/fims/ame/capabilities/audio/language</Type>
				<Unit>pixels</Unit>
			</Capability>
		</CapabilityGroup>
		<CapabilityGroup xsi:type="inputFormatCapabilityGroupType">
			<Capability xsi:type="videoFormatCapabilityType">
				<Values>urn:ebu:metadata-cs:FileFormatCS_2010</Values>
				<Type>http://ebu.io/fims/ame/capabilities/format/video</Type>
			</Capability>
		</CapabilityGroup>
		<CapabilityGroup xsi:type="inputCodecCapabilityGroupType">
			<Capability xsi:type="videoCodecCapabilityType">
				<Values>urn:ebu:metadata-cs:VideoCompressionCodeCS</Values>
				<Type>http://ebu.io/fims/ame/capabilities/codec/video</Type>
			</Capability>
		</CapabilityGroup>
		<CapabilityGroup xsi:type="inputCapabilityGroupType">
			<Capability xsi:type="inputCapabilityType" parameter="StructuredRegionOfInterest">
				<Type>http://ebu.io/fims/ame/capabilities/parameter</Type>
				<Formats>http://abc.com/formats</Formats>
				<Representations>http://abc.com/representations</Representations>
			</Capability>
		</CapabilityGroup>
		<CapabilityGroup xsi:type="resultCapabilityGroupType">
			<Capability xsi:type="resultCapabilityType" parameter="Detection">
				<Type>http://ebu.io/fims/ame/capabilities/parameter</Type>
				<Formats>http://abc.com/formats</Formats>
				<Representations>http://abc.com/representations</Representations>
			</Capability>
		</CapabilityGroup>
	</AMECard>
</FIMSAMECards>
