<?xml version="1.0" encoding="UTF-8"?>
<FIMSAMECards xmlns:xsi="http://www.w3.org/2001/XMLSchema-instance" xsi:noNamespaceSchemaLocation="../schema/FIMS-AME.xsd">
	<AMECard>
		<CardID>M006</CardID>
		<Name>Genre/Subject Recognition (Training)</Name>
		<Type>Multimodal</Type>
		<Status>draft</Status>
		<Editor>Werner</Editor>
		<Definition>Training module for a genre/subject classification service</Definition>
		<Parameters>
			<Inputs>
				<Input mandatory="true">
					<Name>GenreClassificationTrainingData</Name>
					<Type>xml</Type>
					<Comment>Training data contains locators to training essence files and ground truth annotations to train</Comment>
				</Input>
				<Input mandatory="false">
					<Name>ModelIdentifier</Name>
					<Type>URL</Type>
					<Definition>The identifier of the model that shall be trained.</Definition>
				</Input>
			</Inputs>
			<Outputs>
				<Output>
					<Name>TrainedModel</Name>
					<Type>URL</Type>
				</Output>
			</Outputs>
		</Parameters>
		<CapabilityGroup xsi:type="inputFormatCapabilityGroupType">
			<Capability xsi:type="audioFormatCapabilityType">
				<Values>urn:ebu:metadata-cs:FileFormatCS_2010</Values>
				<Type>http://ebu.io/fims/ame/capabilities/format/audio</Type>
			</Capability>
			<Capability xsi:type="videoFormatCapabilityType">
				<Values>urn:ebu:metadata-cs:FileFormatCS_2010</Values>
				<Type>http://ebu.io/fims/ame/capabilities/format/video</Type>
			</Capability>
		</CapabilityGroup>
		<CapabilityGroup xsi:type="inputCodecCapabilityGroupType">
			<Capability xsi:type="audioCodecCapabilityType">
				<Values>urn:ebu:metadata-cs:AudioCompressionCodeCS</Values>
				<Type>http://ebu.io/fims/ame/capabilities/codec/audio</Type>
			</Capability>
			<Capability xsi:type="videoCodecCapabilityType">
				<Values>urn:ebu:metadata-cs:VideoCompressionCodeCS</Values>
				<Type>http://ebu.io/fims/ame/capabilities/codec/video</Type>
			</Capability>
			<Capability xsi:type="textEncodingCapabilityType">
				<Values>https://www.iana.org/assignments/character-sets/character-sets.xhtml</Values>
				<Type>http://ebu.io/fims/ame/capabilities/codec/textencoding</Type>
			</Capability>
		</CapabilityGroup>
		<CapabilityGroup xsi:type="textCapabilityGroupType">
			<Capability xsi:type="textLanguageCapabilityType">
				<Values>urn:iso:std:iso:639:-1 urn:iso:std:iso:639:-2</Values>
				<Type>http://ebu.io/fims/ame/capabilities/text/language</Type>
			</Capability>
			<Capability xsi:type="textScriptCapabilityType">
				<Values>urn:iso:std:iso:15924</Values>
				<Type>http://ebu.io/fims/ame/capabilities/text/script</Type>
			</Capability>
		</CapabilityGroup>
		
		<CapabilityGroup xsi:type="inputCapabilityGroupType">
			<Capability xsi:type="inputCapabilityType" parameter="GenreClassificationTrainingData">
				<Type>http://ebu.io/fims/ame/capabilities/parameter</Type>
				<Formats>http://abc.com/formats</Formats>
				<Representations>http://abc.com/representations</Representations>
			</Capability>
		</CapabilityGroup>
	</AMECard>
</FIMSAMECards>
