<?xml version="1.0" encoding="UTF-8"?>
<!-- edited with XMLSpy v2017 rel. 3 (x64) (http://www.altova.com) by Lauri Saarikoski (Yle - The Finnish Broadcasting Company) -->
<FIMSAMECards xmlns:xsi="http://www.w3.org/2001/XMLSchema-instance" xsi:noNamespaceSchemaLocation="../schema/FIMS-AME.xsd">
	<AMECard>
		<CardID>V005</CardID>
		<Name>Object classification</Name>
		<Type>Video</Type>
		<Status>draft</Status>
		<Editor>Lauri</Editor>
		<Definition>Determine if there are one or more regions showing (part of) a specified/one from a list of specified object class(es), and report their approximate boundaries.</Definition>
		<Parameters>
			<Inputs>
				<Input mandatory="true">
					<Name>ClassesToDetect</Name>
					<Type>xml</Type>
					<Representation/>
				</Input>
				<Input mandatory="true">
					<Name>MinimumObjectSizeToDetect</Name>
					<Type>integer</Type>
					<Representation/>
					<Unit>pixels</Unit>
				</Input>
				<Input>
					<Name>ObjectModelToUse</Name>
					<Type>URL</Type>
					<Definition>If applicable, visual model to use for detection.</Definition>
				</Input>
				<Input>
					<Name>BoundingBox</Name>
					<Type>text</Type>
					<Definition>A bounding box, specified as space separated list of x,y,w,h in pixels.</Definition>
				</Input>
			</Inputs>
			<Outputs>
				<Output mandatory="true">
					<Name>DetectedRegions</Name>
					<Type>xml</Type>
					<Representation>urn:mpeg:mpeg7:part5:MovingRegionType</Representation>
					<Definition>Per object class, a list of time indexed regions</Definition>
				</Output>
				<Output>
					<Name>Confidence</Name>
					<Type>float</Type>
				</Output>
			</Outputs>
		</Parameters>
		<CapabilityGroup xsi:type="genericCapabilityGroupType" type="ObjectClassification">
			<Capability xsi:type="genericCapabilityType" type="ObjectClasses">
				<Values>urn:oiweuowieru</Values>
				<Type>http://ebu.io/fims/ame/capabilities/supportedObjectClasses</Type>
			</Capability>
			<Capability xsi:type="genericCapabilityType" type="minimumSize">
				<Values>int</Values>
				<Type>http://ebu.io/fims/ame/capabilities/miniumObjectSizeInPixels</Type>
			</Capability>
		</CapabilityGroup>
		<CapabilityGroup xsi:type="inputFormatCapabilityGroupType">
			<Capability xsi:type="videoFormatCapabilityType">
				<Values>urn:ebu:metadata-cs:FileFormatCS_2010</Values>
				<Type>http://ebu.io/fims/ame/capabilities/format/video</Type>
			</Capability>
			<Capability xsi:type="imageFormatCapabilityType">
				<Values>urn:ebu:metadata-cs:FileFormatCS_2010</Values>
				<Type>http://ebu.io/fims/ame/capabilities/format/image</Type>
			</Capability>
		</CapabilityGroup>
		<CapabilityGroup xsi:type="inputCodecCapabilityGroupType">
			<Capability xsi:type="videoCodecCapabilityType">
				<Values>urn:ebu:metadata-cs:VideoCompressionCodeCS</Values>
				<Type>http://ebu.io/fims/ame/capabilities/codec/video</Type>
			</Capability>
		</CapabilityGroup>
	</AMECard>
</FIMSAMECards>
