<?xml version="1.0" encoding="UTF-8"?>
<FIMSAMECards xmlns:xsi="http://www.w3.org/2001/XMLSchema-instance" xsi:noNamespaceSchemaLocation="../schema/FIMS-AME.xsd">
	<AMECard>
		<CardID>T001</CardID>
		<Name>Part of speech tagging</Name>
		<Type>Text</Type>
		<Status>draft</Status>
		<Editor>Werner</Editor>
		<Definition>The allocation of categories and relationships of words in a sentence. E.g., verbs or nouns (plural/...).</Definition>
		<Parameters>
			<Inputs>
				<Input>
					<Name>Language</Name>
					<Type>controlled vocabulary</Type>
					<Representation>urn:iso:std:iso:639:-1 urn:iso:std:iso:639:-2</Representation>
					<Definition>The language of the text source</Definition>
				</Input>
				<Input mandatory="false">
					<Name>OutputFormat</Name>
					<Type>controlled vocabulary</Type>
				</Input>
			</Inputs>
			<Outputs>
				<Output>
					<Name>TimedTaggedWords</Name>
					<Type>xml</Type>
					<Type>json</Type>
					<Representation>urn:tbd</Representation>
					<Definition>A list of tagged words, for each the disambiguated category, relationship with other words, confidence score</Definition>
				</Output>
				<Output>
					<Name>UntimedTaggedWords</Name>
					<Type>xml</Type>
					<Type>json</Type>
					<Representation>https://www.w3.org/TR/annotation-model/#selectors</Representation>
					<Definition>A list of tagged words, for each the disambiguated category, relationship with other words, confidence score</Definition>
				</Output>
				
			</Outputs>
		</Parameters>
		
		<CapabilityGroup xsi:type="inputCodecCapabilityGroupType">
			<Capability xsi:type="textEncodingCapabilityType">
				<Values>https://www.iana.org/assignments/character-sets/character-sets.xhtml</Values>
				<Type>http://ebu.io/fims/ame/capabilities/codec/textencoding</Type>
			</Capability>
		</CapabilityGroup>
		<CapabilityGroup xsi:type="inputFormatCapabilityGroupType">
			<Capability xsi:type="textFormatCapabilityType">
				<Values>https://www.iana.org/assignments/media-types/media-types.xhtml</Values>
				<Type>http://ebu.io/fims/ame/capabilities/format/text</Type>
			</Capability>
		</CapabilityGroup>
		<CapabilityGroup xsi:type="textCapabilityGroupType">
			<Capability xsi:type="textLanguageCapabilityType">
				<Values>urn:iso:std:iso:639:-1 urn:iso:std:iso:639:-2</Values>
				<Type>http://ebu.io/fims/ame/capabilities/text/language</Type>
			</Capability>
			<Capability xsi:type="textScriptCapabilityType">
				<Values>urn:iso:std:iso:15924</Values>
				<Type>http://ebu.io/fims/ame/capabilities/text/script</Type>
			</Capability>
		</CapabilityGroup>
		<CapabilityGroup xsi:type="genericCapabilityGroupType" type="POS">
			<Capability xsi:type="genericCapabilityType" >
				<Values>urn:oiweuowieruf</Values>
				<Type>supported categories for words</Type>
			</Capability>
		</CapabilityGroup>
		<CapabilityGroup xsi:type="resultCapabilityGroupType">
			<Capability xsi:type="resultCapabilityType" parameter="TimedTaggedWords">
				<Type>http://ebu.io/fims/ame/capabilities/parameter</Type>
				<Formats>http://abc.com/formats</Formats>
				<Representations>http://abc.com/representations</Representations>
			</Capability>
		</CapabilityGroup>
		<CapabilityGroup xsi:type="resultCapabilityGroupType">
			<Capability xsi:type="resultCapabilityType" parameter="UntimedTaggedWords">
				<Type>http://ebu.io/fims/ame/capabilities/parameter</Type>
				<Formats>http://abc.com/formats</Formats>
				<Representations>http://abc.com/representations</Representations>
			</Capability>
		</CapabilityGroup>
	</AMECard>
</FIMSAMECards>
