<?xml version="1.0" encoding="UTF-8"?>
<!-- Werner Bailer (JOANNEUM RESEARCH) -->
<FIMSAMECards xmlns:xsi="http://www.w3.org/2001/XMLSchema-instance" xsi:noNamespaceSchemaLocation="../schema/FIMS-AME.xsd">
	<AMECard>
		<CardID>T002</CardID>
		<Name>Lemmatization</Name>
		<Type>Text</Type>
		<Status>draft</Status>
		<Editor>Mike</Editor>
		<Definition>The identification of the most relevant words in a text.</Definition>
		<Parameters>
			<Inputs>
			</Inputs>
			<Outputs>
				<Output mandatory="true">
					<Name>StemmedWords</Name>
					<Type>xml</Type>
					<Representation>urn:xyz</Representation>
					<Definition>Each word in the input text in its stemmed form together with morphosyntactic information and a confidence value</Definition>
				</Output>
			</Outputs>
		</Parameters>

		<CapabilityGroup xsi:type="textCapabilityGroupType">
			<Capability xsi:type="textLanguageCapabilityType">
				<Values>urn:iso:std:iso:639:-1 urn:iso:std:iso:639:-2</Values>
				<Type>http://ebu.io/fims/ame/capabilities/text/language</Type>
			</Capability>
		</CapabilityGroup>
		<CapabilityGroup xsi:type="inputFormatCapabilityGroupType">
			<Capability xsi:type="textFormatCapabilityType">
				<Values>https://www.iana.org/assignments/media-types/media-types.xhtml</Values>
				<Type>http://ebu.io/fims/ame/capabilities/format/text</Type>
			</Capability>
		</CapabilityGroup>

	</AMECard>
</FIMSAMECards>
